{
  "schema_version": "1.0",
  "id": "ses_00000000000000000000000000",
  "device_id": "dev_11111111111111111111111111",
  "session": {
    "id": "ses_00000000000000000000000000",
    "runtime": "claude",
    "native_id": "3f6c",
    "catalog_id": "cat-1"
  },
  "workspace": {
    "repository_id": "remote-sha256-v1:abc"
  },
  "events": {
    "count": 3,
    "first_at": "2026-09-29T10:00:00Z",
    "last_at": "2026-09-29T10:05:00Z"
  },
  "chain_claim": {
    "status": "verified",
    "rows": 3,
    "chained": 3,
    "legacy": 0,
    "disk_span": [
      1,
      3
    ],
    "held_span": [
      1,
      3
    ],
    "tail_matches_held": true
  },
  "reported_at": "2026-09-29T10:06:00Z"
}